### ISSUE TITLE
Devices don't show up despite the protocol seems to be working

### ISSUE THREAD

**Issue by manacker** [michbeck100/pimatic-echo#16]
I have no luck getting my device to show up in the Alexa app for my Echo Dot.
I already tried the debug command from issue #7 and if I start a device discovery the following happens, but no device shows up. Is there anything else I can try?

```
  ssdp-server << server got: M-SEARCH * HTTP/1.1
  ssdp-server HOST: 239.255.255.250:1900
  ssdp-server MAN: "ssdp:discover"
  ssdp-server MX: 15
  ssdp-server ST: urn:schemas-upnp-org:device:basic:1
  ssdp-server
  ssdp-server  from 192.168.10.101:50000 +54s
  ssdp-server >> sending response string:  HTTP/1.1 200 OK
CACHE-CONTROL: max-age=86400
DATE: 2016-10-29
EXT:
LOCATION: http://192.168.10.136:12001/8c08a4ea-41da-498f-801b-2bbb9f1ad66d/setup.xml
OPT: "http://schemas.upnp.org/upnp/1/0/"; ns=01
01-NLS: 146
SERVER: Unspecified, UPnP/1.0, Unspecified
ST: urn:Belkin:device:**
USN: uuid:Socket-1_0-8c08a4ea-41da-498f-801b-2bbb9f1ad66d::urn:Belkin:device:**

 +1ms
  ssdp-server >> sending response string:  HTTP/1.1 200 OK
CACHE-CONTROL: max-age=86400
DATE: 2016-10-29
EXT:
LOCATION: http://192.168.10.136:12002/e3056b7e-e519-4740-8d8b-341939351f09/setup.xml
OPT: "http://schemas.upnp.org/upnp/1/0/"; ns=01
01-NLS: 146
SERVER: Unspecified, UPnP/1.0, Unspecified
ST: urn:Belkin:device:**
USN: uuid:Socket-1_0-e3056b7e-e519-4740-8d8b-341939351f09::urn:Belkin:device:**

 +1ms
  ssdp-server >> sending response string:  HTTP/1.1 200 OK
CACHE-CONTROL: max-age=86400
DATE: 2016-10-29
EXT:
LOCATION: http://192.168.10.136:12003/a936362d-b4d8-4182-88b9-64d0da0a1e77/setup.xml
OPT: "http://schemas.upnp.org/upnp/1/0/"; ns=01
01-NLS: 146
SERVER: Unspecified, UPnP/1.0, Unspecified
ST: urn:Belkin:device:**
USN: uuid:Socket-1_0-a936362d-b4d8-4182-88b9-64d0da0a1e77::urn:Belkin:device:**

 +1ms
  ssdp-server >> sending response string:  HTTP/1.1 200 OK
CACHE-CONTROL: max-age=86400
DATE: 2016-10-29
EXT:
LOCATION: http://192.168.10.136:12004/76ed42d2-129d-4543-8704-b4b54208041b/setup.xml
OPT: "http://schemas.upnp.org/upnp/1/0/"; ns=01
01-NLS: 146
SERVER: Unspecified, UPnP/1.0, Unspecified
ST: urn:Belkin:device:**
USN: uuid:Socket-1_0-76ed42d2-129d-4543-8704-b4b54208041b::urn:Belkin:device:**

 +0ms
  ssdp-server sending device response. +1ms
  ssdp-server >> sent response ssdp discovery response +1ms
  ssdp-server sending device response. +0ms
  ssdp-server >> sent response ssdp discovery response +1ms
  ssdp-server sending device response. +0ms
  ssdp-server >> sent response ssdp discovery response +1ms
  ssdp-server sending device response. +0ms
  ssdp-server >> sent response ssdp discovery response +1ms
  ssdp-server complete sending all responses.  Success +0ms
```
(after that it repeats itself)

**Comment by rC0ALT** [comment]
Same issue here! I just can't get my pimatic working with the echo dot..
The debug option, looks like this weirdly: (192.178.168.47 is my windows PC!)
```
+1ms
  ssdp-server sending device response. +3ms
  ssdp-server >> sent response ssdp discovery response +1ms
  ssdp-server complete sending all responses.  Success +1ms
  ssdp-server << server got: M-SEARCH * HTTP/1.1
  ssdp-server HOST: 239.255.255.250:1900
  ssdp-server MAN: "ssdp:discover"
  ssdp-server MX: 1
  ssdp-server ST: urn:dial-multiscreen-org:service:dial:1
  ssdp-server USER-AGENT: Google Chrome/56.0.2924.87 Windows
  ssdp-server
  ssdp-server  from 192.168.178.47:57202 +994ms
  ssdp-server >> sending response string:  HTTP/1.1 200 OK
CACHE-CONTROL: max-age=86400
DATE: 2016-10-29
EXT:
LOCATION: http://192.168.178.52:12001/448c6046-27ec-422f-8be2-6f6cc1210500/setup.xml
OPT: "http://schemas.upnp.org/upnp/1/0/"; ns=01
01-NLS: 13
SERVER: Unspecified, UPnP/1.0, Unspecified
ST: urn:Belkin:device:**
USN: uuid:Socket-1_0-448c6046-27ec-422f-8be2-6f6cc1210500::urn:Belkin:device:**

 +1ms
  ssdp-server sending device response. +3ms
  ssdp-server >> sent response ssdp discovery response +1ms
  ssdp-server complete sending all responses.  Success +1ms
  ssdp-server << server got: M-SEARCH * HTTP/1.1
  ssdp-server HOST: 239.255.255.250:1900
  ssdp-server MAN: "ssdp:discover"
  ssdp-server MX: 1
  ssdp-server ST: urn:dial-multiscreen-org:service:dial:1
  ssdp-server USER-AGENT: Google Chrome/56.0.2924.87 Windows
  ssdp-server
  ssdp-server  from 192.168.178.47:57202 +995ms
  ssdp-server >> sending response string:  HTTP/1.1 200 OK
CACHE-CONTROL: max-age=86400
DATE: 2016-10-29
EXT:
LOCATION: http://192.168.178.52:12001/448c6046-27ec-422f-8be2-6f6cc1210500/setup.xml
OPT: "http://schemas.upnp.org/upnp/1/0/"; ns=01
01-NLS: 13
SERVER: Unspecified, UPnP/1.0, Unspecified
ST: urn:Belkin:device:**
USN: uuid:Socket-1_0-448c6046-27ec-422f-8be2-6f6cc1210500::urn:Belkin:device:**`
```

**Comment by michbeck100** [comment]
Did both of you make sure that the device discovery request comes from your echoes? Please check the IP adresses. You wouldn't believe which devices send these requests (like chrome as seen in the post of @rC0ALT)

**Comment by rC0ALT** [comment]
Thanks for your reply!
It seems like there was something messed up in my network. I connected my Pi to another switch and its working just fine now.
@manacker You could try to set up a seperate network to test if your problem is also network related!

**Comment by manacker** [comment]
I'm sure that in my case the requests indeed came from the Echo Dot. I compared the MAC addresses in the Alexa app with that from my router and 192.168.10.101 is the IP address of the Echo device. I also managed to inspect the IP traffic to see the follow-up requests to the respective setup.xml of the pimatic devices, but nevertheless they don't show up in the Alexa app.
Unfortunately I'm currently not at home to produce more detailed logs, but I get back to you as soon as I can give it another try.

**Comment by michbeck100** [comment]
@manacker Did you try the latest update? I changed a log since your last comment.

**Comment by michbeck100** [comment]
@manacker Do you still have problems when discovering devices?

**Comment by manacker** [comment]
@michbeck100 Still no luck, I'm afraid. If you got anything else I should try, let me know.

```
<< server got: M-SEARCH * HTTP/1.1
>HOST: 239.255.255.250:1900
>MAN: "ssdp:discover"
>MX: 15
>ST: urn:schemas-upnp-org:device:basic:1
>
> from 192.168.10.101:50000
 >> sent response ssdp discovery response: HTTP/1.1 200 OK
>HOST: 239.255.255.250:1900
>CACHE-CONTROL: max-age=100
>EXT:
>LOCATION: http://192.168.10.136:9876/description.xml
>SERVER: Linux/3.14.0 UPnP/1.0 IpBridge/1.19.0
>hue-bridgeid: B827EBFFFE3D450E
>ST: upnp:rootdevice
>USN: uuid:2f402f80-da50-11e1-9b23-b827eb3d450e::upnp:rootdevice
>
>
 >> sent response ssdp discovery response: HTTP/1.1 200 OK
>HOST: 239.255.255.250:1900
>CACHE-CONTROL: max-age=100
>EXT:
>LOCATION: http://192.168.10.136:9876/description.xml
>SERVER: Linux/3.14.0 UPnP/1.0 IpBridge/1.19.0
>hue-bridgeid: B827EBFFFE3D450E
>ST: uuid:2f402f80-da50-11e1-9b23-b827eb3d450e
>USN: uuid:2f402f80-da50-11e1-9b23-b827eb3d450e
>
>
 >> sent response ssdp discovery response: HTTP/1.1 200 OK
>HOST: 239.255.255.250:1900
>CACHE-CONTROL: max-age=100
>LOCATION: http://192.168.10.136:9876/description.xml
>SERVER: Linux/3.14.0 UPnP/1.0 IpBridge/1.19.0
>hue-bridgeid: B827EBFFFE3D450E
>ST: urn:schemas-upnp-org:device:basic:1
>USN: uuid:2f402f80-da50-11e1-9b23-b827eb3d450e
>
>
 complete sending all responses.
 << server got: M-SEARCH * HTTP/1.1
>HOST: 239.255.255.250:1900
>MAN: "ssdp:discover"
>MX: 15
>ST: urn:schemas-upnp-org:device:basic:1
>
> from 192.168.10.101:50000
 >> sent response ssdp discovery response: HTTP/1.1 200 OK
>HOST: 239.255.255.250:1900
>CACHE-CONTROL: max-age=100
>EXT:
>LOCATION: http://192.168.10.136:9876/description.xml
>SERVER: Linux/3.14.0 UPnP/1.0 IpBridge/1.19.0
>hue-bridgeid: B827EBFFFE3D450E
>ST: upnp:rootdevice
>USN: uuid:2f402f80-da50-11e1-9b23-b827eb3d450e::upnp:rootdevice
>
>
 >> sent response ssdp discovery response: HTTP/1.1 200 OK
>HOST: 239.255.255.250:1900
>CACHE-CONTROL: max-age=100
>EXT:
>LOCATION: http://192.168.10.136:9876/description.xml
>SERVER: Linux/3.14.0 UPnP/1.0 IpBridge/1.19.0
>hue-bridgeid: B827EBFFFE3D450E
>ST: uuid:2f402f80-da50-11e1-9b23-b827eb3d450e
>USN: uuid:2f402f80-da50-11e1-9b23-b827eb3d450e
>
>
 >> sent response ssdp discovery response: HTTP/1.1 200 OK
>HOST: 239.255.255.250:1900
>CACHE-CONTROL: max-age=100
>LOCATION: http://192.168.10.136:9876/description.xml
>SERVER: Linux/3.14.0 UPnP/1.0 IpBridge/1.19.0
>hue-bridgeid: B827EBFFFE3D450E
>ST: urn:schemas-upnp-org:device:basic:1
>USN: uuid:2f402f80-da50-11e1-9b23-b827eb3d450e
>
>
 complete sending all responses.
```

**Comment by michbeck100** [comment]
Your echo dot has 192.168.10.101?

**Comment by manacker** [comment]
Yes, indeed.

**Comment by michbeck100** [comment]
Sorry, but I can't tell what the problem could be. As everyone else doesn't have problems with discovering their devices, I would still guess its your network setup. Are you using the Wifi or LAN Connection on your Raspi?

**Comment by 0rTiN** [comment]
Hi, my Echo 2 as well has problems to discover pimatic provided devices:

`11:06:02.558 [pimatic-echo] debug: << server got: M-SEARCH * HTTP/1.1
11:06:02.558 [pimatic-echo] debug:>MX: 3
11:06:02.558 [pimatic-echo] debug:>ST: ssdp:all
11:06:02.558 [pimatic-echo] debug:>HOST: 239.255.255.250:1900
11:06:02.558 [pimatic-echo] debug:>MAN: "ssdp:discover"
11:06:02.558 [pimatic-echo] debug:>
11:06:02.558 [pimatic-echo] debug:> from 192.168.178.111:50000
11:06:02.570 [pimatic-echo] debug: >> sent response ssdp discovery response: HTTP/1.1 200 OK
11:06:02.570 [pimatic-echo] debug:>CACHE-CONTROL: max-age=86400
11:06:02.570 [pimatic-echo] debug:>DATE: 2016-10-29
11:06:02.570 [pimatic-echo] debug:>EXT:
11:06:02.570 [pimatic-echo] debug:>LOCATION: http://192.168.178.200:12000/c8bee773-e838-4513-88ec-6268d9900b6a/setup.xml
11:06:02.570 [pimatic-echo] debug:>OPT: "http://schemas.upnp.org/upnp/1/0/"; ns=01
11:06:02.570 [pimatic-echo] debug:>01-NLS: 1
11:06:02.570 [pimatic-echo] debug:>SERVER: Unspecified, UPnP/1.0, Unspecified
11:06:02.570 [pimatic-echo] debug:>ST: urn:Belkin:device:**
11:06:02.570 [pimatic-echo] debug:>USN: uuid:Socket-1_0-c8bee773-e838-4513-88ec-6268d9900b6a::urn:Belkin:device:**
11:06:02.570 [pimatic-echo] debug:>
11:06:02.570 [pimatic-echo] debug:>
11:06:02.574 [pimatic-echo] debug: >> sent response ssdp discovery response: HTTP/1.1 200 OK
11:06:02.574 [pimatic-echo] debug:>CACHE-CONTROL: max-age=86400
11:06:02.574 [pimatic-echo] debug:>DATE: 2016-10-29
11:06:02.574 [pimatic-echo] debug:>EXT:
11:06:02.574 [pimatic-echo] debug:>LOCATION: http://192.168.178.200:12001/532eaabd-5748-4dbf-8b9b-cc00832c20a6/setup.xml
11:06:02.574 [pimatic-echo] debug:>OPT: "http://schemas.upnp.org/upnp/1/0/"; ns=01
11:06:02.574 [pimatic-echo] debug:>01-NLS: 1
11:06:02.574 [pimatic-echo] debug:>SERVER: Unspecified, UPnP/1.0, Unspecified
11:06:02.574 [pimatic-echo] debug:>ST: urn:Belkin:device:**
11:06:02.574 [pimatic-echo] debug:>USN: uuid:Socket-1_0-532eaabd-5748-4dbf-8b9b-cc00832c20a6::urn:Belkin:device:**
11:06:02.574 [pimatic-echo] debug:>
11:06:02.574 [pimatic-echo] debug:>
11:06:02.577 [pimatic-echo] debug: >> sent response ssdp discovery response: HTTP/1.1 200 OK
11:06:02.577 [pimatic-echo] debug:>CACHE-CONTROL: max-age=86400
11:06:02.577 [pimatic-echo] debug:>DATE: 2016-10-29
11:06:02.577 [pimatic-echo] debug:>EXT:
11:06:02.577 [pimatic-echo] debug:>LOCATION: http://192.168.178.200:12002/4df3c3f6-fcc8-427e-842c-0431a72499f1/setup.xml
11:06:02.577 [pimatic-echo] debug:>OPT: "http://schemas.upnp.org/upnp/1/0/"; ns=01
11:06:02.577 [pimatic-echo] debug:>01-NLS: 1
11:06:02.577 [pimatic-echo] debug:>SERVER: Unspecified, UPnP/1.0, Unspecified
11:06:02.577 [pimatic-echo] debug:>ST: urn:Belkin:device:**
11:06:02.577 [pimatic-echo] debug:>USN: uuid:Socket-1_0-4df3c3f6-fcc8-427e-842c-0431a72499f1::urn:Belkin:device:**
11:06:02.577 [pimatic-echo] debug:>
11:06:02.577 [pimatic-echo] debug:>
11:06:02.580 [pimatic-echo] debug: >> sent response ssdp discovery response: HTTP/1.1 200 OK
11:06:02.580 [pimatic-echo] debug:>HOST: 239.255.255.250:1900
11:06:02.580 [pimatic-echo] debug:>CACHE-CONTROL: max-age=100
11:06:02.580 [pimatic-echo] debug:>EXT:
11:06:02.580 [pimatic-echo] debug:>LOCATION: http://192.168.178.200:9876/description.xml
11:06:02.580 [pimatic-echo] debug:>SERVER: Linux/3.14.0 UPnP/1.0 IpBridge/1.19.0
11:06:02.580 [pimatic-echo] debug:>hue-bridgeid: B827EBFFFE5A5980
11:06:02.580 [pimatic-echo] debug:>ST: upnp:rootdevice
11:06:02.580 [pimatic-echo] debug:>USN: uuid:2f402f80-da50-11e1-9b23-b827eb5a5980::upnp:rootdevice
11:06:02.580 [pimatic-echo] debug:>
11:06:02.580 [pimatic-echo] debug:>
11:06:02.582 [pimatic-echo] debug: >> sent response ssdp discovery response: HTTP/1.1 200 OK
11:06:02.582 [pimatic-echo] debug:>HOST: 239.255.255.250:1900
11:06:02.582 [pimatic-echo] debug:>CACHE-CONTROL: max-age=100
11:06:02.582 [pimatic-echo] debug:>EXT:
11:06:02.582 [pimatic-echo] debug:>LOCATION: http://192.168.178.200:9876/description.xml
11:06:02.582 [pimatic-echo] debug:>SERVER: Linux/3.14.0 UPnP/1.0 IpBridge/1.19.0
11:06:02.582 [pimatic-echo] debug:>hue-bridgeid: B827EBFFFE5A5980
11:06:02.582 [pimatic-echo] debug:>ST: uuid:2f402f80-da50-11e1-9b23-b827eb5a5980
11:06:02.582 [pimatic-echo] debug:>USN: uuid:2f402f80-da50-11e1-9b23-b827eb5a5980
11:06:02.582 [pimatic-echo] debug:>
11:06:02.582 [pimatic-echo] debug:>
11:06:02.585 [pimatic-echo] debug: >> sent response ssdp discovery response: HTTP/1.1 200 OK
11:06:02.585 [pimatic-echo] debug:>HOST: 239.255.255.250:1900
11:06:02.585 [pimatic-echo] debug:>CACHE-CONTROL: max-age=100
11:06:02.585 [pimatic-echo] debug:>LOCATION: http://192.168.178.200:9876/description.xml
11:06:02.585 [pimatic-echo] debug:>SERVER: Linux/3.14.0 UPnP/1.0 IpBridge/1.19.0
11:06:02.585 [pimatic-echo] debug:>hue-bridgeid: B827EBFFFE5A5980
11:06:02.585 [pimatic-echo] debug:>ST: urn:schemas-upnp-org:device:basic:1
11:06:02.585 [pimatic-echo] debug:>USN: uuid:2f402f80-da50-11e1-9b23-b827eb5a5980
11:06:02.585 [pimatic-echo] debug:>
11:06:02.585 [pimatic-echo] debug:>
11:06:02.588 [pimatic-echo] debug: complete sending all responses.
11:06:02.600 [pimatic-echo] debug: << server got: M-SEARCH * HTTP/1.1
11:06:02.600 [pimatic-echo] debug:>MX: 3
11:06:02.600 [pimatic-echo] debug:>ST: upnp:rootdevice
11:06:02.600 [pimatic-echo] debug:>HOST: 239.255.255.250:1900
11:06:02.600 [pimatic-echo] debug:>MAN: "ssdp:discover"
11:06:02.600 [pimatic-echo] debug:>
11:06:02.600 [pimatic-echo] debug:> from 192.168.178.111:50000
11:06:02.604 [pimatic-echo] debug: >> sent response ssdp discovery response: HTTP/1.1 200 OK
11:06:02.604 [pimatic-echo] debug:>CACHE-CONTROL: max-age=86400
11:06:02.604 [pimatic-echo] debug:>DATE: 2016-10-29
11:06:02.604 [pimatic-echo] debug:>EXT:
11:06:02.604 [pimatic-echo] debug:>LOCATION: http://192.168.178.200:12000/c8bee773-e838-4513-88ec-6268d9900b6a/setup.xml
11:06:02.604 [pimatic-echo] debug:>OPT: "http://schemas.upnp.org/upnp/1/0/"; ns=01
11:06:02.604 [pimatic-echo] debug:>01-NLS: 1
11:06:02.604 [pimatic-echo] debug:>SERVER: Unspecified, UPnP/1.0, Unspecified
11:06:02.604 [pimatic-echo] debug:>ST: urn:Belkin:device:**
11:06:02.604 [pimatic-echo] debug:>USN: uuid:Socket-1_0-c8bee773-e838-4513-88ec-6268d9900b6a::urn:Belkin:device:**
11:06:02.604 [pimatic-echo] debug:>
11:06:02.604 [pimatic-echo] debug:>
11:06:02.606 [pimatic-echo] debug: >> sent response ssdp discovery response: HTTP/1.1 200 OK
11:06:02.606 [pimatic-echo] debug:>CACHE-CONTROL: max-age=86400
11:06:02.606 [pimatic-echo] debug:>DATE: 2016-10-29
11:06:02.606 [pimatic-echo] debug:>EXT:
11:06:02.606 [pimatic-echo] debug:>LOCATION: http://192.168.178.200:12001/532eaabd-5748-4dbf-8b9b-cc00832c20a6/setup.xml
11:06:02.606 [pimatic-echo] debug:>OPT: "http://schemas.upnp.org/upnp/1/0/"; ns=01
11:06:02.606 [pimatic-echo] debug:>01-NLS: 1
11:06:02.606 [pimatic-echo] debug:>SERVER: Unspecified, UPnP/1.0, Unspecified
11:06:02.606 [pimatic-echo] debug:>ST: urn:Belkin:device:**
11:06:02.606 [pimatic-echo] debug:>USN: uuid:Socket-1_0-532eaabd-5748-4dbf-8b9b-cc00832c20a6::urn:Belkin:device:**
11:06:02.606 [pimatic-echo] debug:>
11:06:02.606 [pimatic-echo] debug:>
11:06:02.608 [pimatic-echo] debug: >> sent response ssdp discovery response: HTTP/1.1 200 OK
11:06:02.608 [pimatic-echo] debug:>CACHE-CONTROL: max-age=86400
11:06:02.608 [pimatic-echo] debug:>DATE: 2016-10-29
11:06:02.608 [pimatic-echo] debug:>EXT:
11:06:02.608 [pimatic-echo] debug:>LOCATION: http://192.168.178.200:12002/4df3c3f6-fcc8-427e-842c-0431a72499f1/setup.xml
11:06:02.608 [pimatic-echo] debug:>OPT: "http://schemas.upnp.org/upnp/1/0/"; ns=01
11:06:02.608 [pimatic-echo] debug:>01-NLS: 1
11:06:02.608 [pimatic-echo] debug:>SERVER: Unspecified, UPnP/1.0, Unspecified
11:06:02.608 [pimatic-echo] debug:>ST: urn:Belkin:device:**
11:06:02.608 [pimatic-echo] debug:>USN: uuid:Socket-1_0-4df3c3f6-fcc8-427e-842c-0431a72499f1::urn:Belkin:device:**
11:06:02.608 [pimatic-echo] debug:>
11:06:02.608 [pimatic-echo] debug:>
11:06:02.612 [pimatic-echo] debug: >> sent response ssdp discovery response: HTTP/1.1 200 OK
11:06:02.612 [pimatic-echo] debug:>HOST: 239.255.255.250:1900
11:06:02.612 [pimatic-echo] debug:>CACHE-CONTROL: max-age=100
11:06:02.612 [pimatic-echo] debug:>EXT:
11:06:02.612 [pimatic-echo] debug:>LOCATION: http://192.168.178.200:9876/description.xml
11:06:02.612 [pimatic-echo] debug:>SERVER: Linux/3.14.0 UPnP/1.0 IpBridge/1.19.0
11:06:02.612 [pimatic-echo] debug:>hue-bridgeid: B827EBFFFE5A5980
11:06:02.612 [pimatic-echo] debug:>ST: upnp:rootdevice
11:06:02.612 [pimatic-echo] debug:>USN: uuid:2f402f80-da50-11e1-9b23-b827eb5a5980::upnp:rootdevice
11:06:02.612 [pimatic-echo] debug:>
11:06:02.612 [pimatic-echo] debug:>
11:06:02.614 [pimatic-echo] debug: >> sent response ssdp discovery response: HTTP/1.1 200 OK
11:06:02.614 [pimatic-echo] debug:>HOST: 239.255.255.250:1900
11:06:02.614 [pimatic-echo] debug:>CACHE-CONTROL: max-age=100
11:06:02.614 [pimatic-echo] debug:>EXT:
11:06:02.614 [pimatic-echo] debug:>LOCATION: http://192.168.178.200:9876/description.xml
11:06:02.614 [pimatic-echo] debug:>SERVER: Linux/3.14.0 UPnP/1.0 IpBridge/1.19.0
11:06:02.614 [pimatic-echo] debug:>hue-bridgeid: B827EBFFFE5A5980
11:06:02.614 [pimatic-echo] debug:>ST: uuid:2f402f80-da50-11e1-9b23-b827eb5a5980
11:06:02.614 [pimatic-echo] debug:>USN: uuid:2f402f80-da50-11e1-9b23-b827eb5a5980
11:06:02.614 [pimatic-echo] debug:>
11:06:02.614 [pimatic-echo] debug:>
11:06:02.617 [pimatic-echo] debug: >> sent response ssdp discovery response: HTTP/1.1 200 OK
11:06:02.617 [pimatic-echo] debug:>HOST: 239.255.255.250:1900
11:06:02.617 [pimatic-echo] debug:>CACHE-CONTROL: max-age=100
11:06:02.617 [pimatic-echo] debug:>LOCATION: http://192.168.178.200:9876/description.xml
11:06:02.617 [pimatic-echo] debug:>SERVER: Linux/3.14.0 UPnP/1.0 IpBridge/1.19.0
11:06:02.617 [pimatic-echo] debug:>hue-bridgeid: B827EBFFFE5A5980
11:06:02.617 [pimatic-echo] debug:>ST: urn:schemas-upnp-org:device:basic:1
11:06:02.617 [pimatic-echo] debug:>USN: uuid:2f402f80-da50-11e1-9b23-b827eb5a5980
11:06:02.617 [pimatic-echo] debug:>
11:06:02.617 [pimatic-echo] debug:>
11:06:02.620 [pimatic-echo] debug: complete sending all responses.
11:06:02.818 [pimatic-echo] debug: Request to /description.xml
11:06:02.881 [pimatic-echo] debug: Request to /description.xml
11:06:04.205 [pimatic-echo] debug: << server got: M-SEARCH * HTTP/1.1
11:06:04.205 [pimatic-echo] debug:>MX: 3
11:06:04.205 [pimatic-echo] debug:>ST: ssdp:all
11:06:04.205 [pimatic-echo] debug:>HOST: 239.255.255.250:1900
11:06:04.205 [pimatic-echo] debug:>MAN: "ssdp:discover"
11:06:04.205 [pimatic-echo] debug:>
11:06:04.205 [pimatic-echo] debug:> from 192.168.178.111:50000
11:06:04.210 [pimatic-echo] debug: << server got: M-SEARCH * HTTP/1.1
11:06:04.210 [pimatic-echo] debug:>MX: 3
11:06:04.210 [pimatic-echo] debug:>ST: upnp:rootdevice
11:06:04.210 [pimatic-echo] debug:>HOST: 239.255.255.250:1900
11:06:04.210 [pimatic-echo] debug:>MAN: "ssdp:discover"
11:06:04.210 [pimatic-echo] debug:>
11:06:04.210 [pimatic-echo] debug:> from 192.168.178.111:50000
11:06:04.213 [pimatic-echo] debug: << server got: M-SEARCH * HTTP/1.1
11:06:04.213 [pimatic-echo] debug:>MX: 3
11:06:04.213 [pimatic-echo] debug:>ST: ssdp:all
11:06:04.213 [pimatic-echo] debug:>HOST: 239.255.255.250:1900
11:06:04.213 [pimatic-echo] debug:>MAN: "ssdp:discover"
11:06:04.213 [pimatic-echo] debug:>
11:06:04.213 [pimatic-echo] debug:> from 192.168.178.111:50000
11:06:04.215 [pimatic-echo] debug: << server got: M-SEARCH * HTTP/1.1
11:06:04.215 [pimatic-echo] debug:>MX: 3
11:06:04.215 [pimatic-echo] debug:>ST: upnp:rootdevice
11:06:04.215 [pimatic-echo] debug:>HOST: 239.255.255.250:1900
11:06:04.215 [pimatic-echo] debug:>MAN: "ssdp:discover"
11:06:04.215 [pimatic-echo] debug:>
11:06:04.215 [pimatic-echo] debug:> from 192.168.178.111:50000
11:06:04.219 [pimatic-echo] debug: << server got: M-SEARCH * HTTP/1.1
11:06:04.219 [pimatic-echo] debug:>MX: 3
11:06:04.219 [pimatic-echo] debug:>ST: ssdp:all
11:06:04.219 [pimatic-echo] debug:>HOST: 239.255.255.250:1900
11:06:04.219 [pimatic-echo] debug:>MAN: "ssdp:discover"
11:06:04.219 [pimatic-echo] debug:>
11:06:04.219 [pimatic-echo] debug:> from 192.168.178.111:50000
11:06:04.221 [pimatic-echo] debug: << server got: M-SEARCH * HTTP/1.1
11:06:04.221 [pimatic-echo] debug:>MX: 3
11:06:04.221 [pimatic-echo] debug:>ST: upnp:rootdevice
11:06:04.221 [pimatic-echo] debug:>HOST: 239.255.255.250:1900
11:06:04.221 [pimatic-echo] debug:>MAN: "ssdp:discover"
11:06:04.221 [pimatic-echo] debug:>
11:06:04.221 [pimatic-echo] debug:> from 192.168.178.111:50000
11:06:04.237 [pimatic-echo] debug: >> sent response ssdp discovery response: HTTP/1.1 200 OK
11:06:04.237 [pimatic-echo] debug:>CACHE-CONTROL: max-age=86400
11:06:04.237 [pimatic-echo] debug:>DATE: 2016-10-29
11:06:04.237 [pimatic-echo] debug:>EXT:
11:06:04.237 [pimatic-echo] debug:>LOCATION: http://192.168.178.200:12000/c8bee773-e838-4513-88ec-6268d9900b6a/setup.xml
11:06:04.237 [pimatic-echo] debug:>OPT: "http://schemas.upnp.org/upnp/1/0/"; ns=01
11:06:04.237 [pimatic-echo] debug:>01-NLS: 1
11:06:04.237 [pimatic-echo] debug:>SERVER: Unspecified, UPnP/1.0, Unspecified
11:06:04.237 [pimatic-echo] debug:>ST: urn:Belkin:device:**
11:06:04.237 [pimatic-echo] debug:>USN: uuid:Socket-1_0-c8bee773-e838-4513-88ec-6268d9900b6a::urn:Belkin:device:**
11:06:04.237 [pimatic-echo] debug:>
11:06:04.237 [pimatic-echo] debug:>
11:06:04.240 [pimatic-echo] debug: >> sent response ssdp discovery response: HTTP/1.1 200 OK
11:06:04.240 [pimatic-echo] debug:>CACHE-CONTROL: max-age=86400
11:06:04.240 [pimatic-echo] debug:>DATE: 2016-10-29
11:06:04.240 [pimatic-echo] debug:>EXT:
11:06:04.240 [pimatic-echo] debug:>LOCATION: http://192.168.178.200:12000/c8bee773-e838-4513-88ec-6268d9900b6a/setup.xml
11:06:04.240 [pimatic-echo] debug:>OPT: "http://schemas.upnp.org/upnp/1/0/"; ns=01
11:06:04.240 [pimatic-echo] debug:>01-NLS: 1
11:06:04.240 [pimatic-echo] debug:>SERVER: Unspecified, UPnP/1.0, Unspecified
11:06:04.240 [pimatic-echo] debug:>ST: urn:Belkin:device:**
11:06:04.240 [pimatic-echo] debug:>USN: uuid:Socket-1_0-c8bee773-e838-4513-88ec-6268d9900b6a::urn:Belkin:device:**
11:06:04.240 [pimatic-echo] debug:>
11:06:04.240 [pimatic-echo] debug:>
11:06:04.242 [pimatic-echo] debug: >> sent response ssdp discovery response: HTTP/1.1 200 OK
11:06:04.242 [pimatic-echo] debug:>CACHE-CONTROL: max-age=86400
11:06:04.242 [pimatic-echo] debug:>DATE: 2016-10-29
11:06:04.242 [pimatic-echo] debug:>EXT:
11:06:04.242 [pimatic-echo] debug:>LOCATION: http://192.168.178.200:12000/c8bee773-e838-4513-88ec-6268d9900b6a/setup.xml
11:06:04.242 [pimatic-echo] debug:>OPT: "http://schemas.upnp.org/upnp/1/0/"; ns=01
11:06:04.242 [pimatic-echo] debug:>01-NLS: 1
11:06:04.242 [pimatic-echo] debug:>SERVER: Unspecified, UPnP/1.0, Unspecified
11:06:04.242 [pimatic-echo] debug:>ST: urn:Belkin:device:**
11:06:04.242 [pimatic-echo] debug:>USN: uuid:Socket-1_0-c8bee773-e838-4513-88ec-6268d9900b6a::urn:Belkin:device:**
11:06:04.242 [pimatic-echo] debug:>
11:06:04.242 [pimatic-echo] debug:>
11:06:04.246 [pimatic-echo] debug: >> sent response ssdp discovery response: HTTP/1.1 200 OK
11:06:04.246 [pimatic-echo] debug:>CACHE-CONTROL: max-age=86400
11:06:04.246 [pimatic-echo] debug:>DATE: 2016-10-29
11:06:04.246 [pimatic-echo] debug:>EXT:
11:06:04.246 [pimatic-echo] debug:>LOCATION: http://192.168.178.200:12000/c8bee773-e838-4513-88ec-6268d9900b6a/setup.xml
11:06:04.246 [pimatic-echo] debug:>OPT: "http://schemas.upnp.org/upnp/1/0/"; ns=01
11:06:04.246 [pimatic-echo] debug:>01-NLS: 1
11:06:04.246 [pimatic-echo] debug:>SERVER: Unspecified, UPnP/1.0, Unspecified
11:06:04.246 [pimatic-echo] debug:>ST: urn:Belkin:device:**
11:06:04.246 [pimatic-echo] debug:>USN: uuid:Socket-1_0-c8bee773-e838-4513-88ec-6268d9900b6a::urn:Belkin:device:**
11:06:04.246 [pimatic-echo] debug:>
11:06:04.246 [pimatic-echo] debug:>
11:06:04.248 [pimatic-echo] debug: >> sent response ssdp discovery response: HTTP/1.1 200 OK
11:06:04.248 [pimatic-echo] debug:>CACHE-CONTROL: max-age=86400
11:06:04.248 [pimatic-echo] debug:>DATE: 2016-10-29
11:06:04.248 [pimatic-echo] debug:>EXT:
11:06:04.248 [pimatic-echo] debug:>LOCATION: http://192.168.178.200:12000/c8bee773-e838-4513-88ec-6268d9900b6a/setup.xml
11:06:04.248 [pimatic-echo] debug:>OPT: "http://schemas.upnp.org/upnp/1/0/"; ns=01
11:06:04.248 [pimatic-echo] debug:>01-NLS: 1
11:06:04.248 [pimatic-echo] debug:>SERVER: Unspecified, UPnP/1.0, Unspecified
11:06:04.248 [pimatic-echo] debug:>ST: urn:Belkin:device:**
11:06:04.248 [pimatic-echo] debug:>USN: uuid:Socket-1_0-c8bee773-e838-4513-88ec-6268d9900b6a::urn:Belkin:device:**
11:06:04.248 [pimatic-echo] debug:>
11:06:04.248 [pimatic-echo] debug:>
11:06:04.250 [pimatic-echo] debug: >> sent response ssdp discovery response: HTTP/1.1 200 OK
11:06:04.250 [pimatic-echo] debug:>CACHE-CONTROL: max-age=86400
11:06:04.250 [pimatic-echo] debug:>DATE: 2016-10-29
11:06:04.250 [pimatic-echo] debug:>EXT:
11:06:04.250 [pimatic-echo] debug:>LOCATION: http://192.168.178.200:12000/c8bee773-e838-4513-88ec-6268d9900b6a/setup.xml
11:06:04.250 [pimatic-echo] debug:>OPT: "http://schemas.upnp.org/upnp/1/0/"; ns=01
11:06:04.250 [pimatic-echo] debug:>01-NLS: 1
11:06:04.250 [pimatic-echo] debug:>SERVER: Unspecified, UPnP/1.0, Unspecified
11:06:04.250 [pimatic-echo] debug:>ST: urn:Belkin:device:**
11:06:04.250 [pimatic-echo] debug:>USN: uuid:Socket-1_0-c8bee773-e838-4513-88ec-6268d9900b6a::urn:Belkin:device:**
11:06:04.250 [pimatic-echo] debug:>
11:06:04.250 [pimatic-echo] debug:>
11:06:04.252 [pimatic-echo] debug: >> sent response ssdp discovery response: HTTP/1.1 200 OK
11:06:04.252 [pimatic-echo] debug:>CACHE-CONTROL: max-age=86400
11:06:04.252 [pimatic-echo] debug:>DATE: 2016-10-29
11:06:04.252 [pimatic-echo] debug:>EXT:
11:06:04.252 [pimatic-echo] debug:>LOCATION: http://192.168.178.200:12001/532eaabd-5748-4dbf-8b9b-cc00832c20a6/setup.xml
11:06:04.252 [pimatic-echo] debug:>OPT: "http://schemas.upnp.org/upnp/1/0/"; ns=01
11:06:04.252 [pimatic-echo] debug:>01-NLS: 1
11:06:04.252 [pimatic-echo] debug:>SERVER: Unspecified, UPnP/1.0, Unspecified
11:06:04.252 [pimatic-echo] debug:>ST: urn:Belkin:device:**
11:06:04.252 [pimatic-echo] debug:>USN: uuid:Socket-1_0-532eaabd-5748-4dbf-8b9b-cc00832c20a6::urn:Belkin:device:**
11:06:04.252 [pimatic-echo] debug:>
11:06:04.252 [pimatic-echo] debug:>
11:06:04.256 [pimatic-echo] debug: >> sent response ssdp discovery response: HTTP/1.1 200 OK
11:06:04.256 [pimatic-echo] debug:>CACHE-CONTROL: max-age=86400
11:06:04.256 [pimatic-echo] debug:>DATE: 2016-10-29
11:06:04.256 [pimatic-echo] debug:>EXT:
11:06:04.256 [pimatic-echo] debug:>LOCATION: http://192.168.178.200:12001/532eaabd-5748-4dbf-8b9b-cc00832c20a6/setup.xml
11:06:04.256 [pimatic-echo] debug:>OPT: "http://schemas.upnp.org/upnp/1/0/"; ns=01
11:06:04.256 [pimatic-echo] debug:>01-NLS: 1
11:06:04.256 [pimatic-echo] debug:>SERVER: Unspecified, UPnP/1.0, Unspecified
11:06:04.256 [pimatic-echo] debug:>ST: urn:Belkin:device:**
11:06:04.256 [pimatic-echo] debug:>USN: uuid:Socket-1_0-532eaabd-5748-4dbf-8b9b-cc00832c20a6::urn:Belkin:device:**
11:06:04.256 [pimatic-echo] debug:>
11:06:04.256 [pimatic-echo] debug:>
11:06:04.258 [pimatic-echo] debug: >> sent response ssdp discovery response: HTTP/1.1 200 OK
11:06:04.258 [pimatic-echo] debug:>CACHE-CONTROL: max-age=86400
11:06:04.258 [pimatic-echo] debug:>DATE: 2016-10-29
11:06:04.258 [pimatic-echo] debug:>EXT:
11:06:04.258 [pimatic-echo] debug:>LOCATION: http://192.168.178.200:12001/532eaabd-5748-4dbf-8b9b-cc00832c20a6/setup.xml
11:06:04.258 [pimatic-echo] debug:>OPT: "http://schemas.upnp.org/upnp/1/0/"; ns=01
11:06:04.258 [pimatic-echo] debug:>01-NLS: 1
11:06:04.258 [pimatic-echo] debug:>SERVER: Unspecified, UPnP/1.0, Unspecified
11:06:04.258 [pimatic-echo] debug:>ST: urn:Belkin:device:**
11:06:04.258 [pimatic-echo] debug:>USN: uuid:Socket-1_0-532eaabd-5748-4dbf-8b9b-cc00832c20a6::urn:Belkin:device:**
11:06:04.258 [pimatic-echo] debug:>
11:06:04.258 [pimatic-echo] debug:>
11:06:04.260 [pimatic-echo] debug: >> sent response ssdp discovery response: HTTP/1.1 200 OK
11:06:04.260 [pimatic-echo] debug:>CACHE-CONTROL: max-age=86400
11:06:04.260 [pimatic-echo] debug:>DATE: 2016-10-29
11:06:04.260 [pimatic-echo] debug:>EXT:
11:06:04.260 [pimatic-echo] debug:>LOCATION: http://192.168.178.200:12001/532eaabd-5748-4dbf-8b9b-cc00832c20a6/setup.xml
11:06:04.260 [pimatic-echo] debug:>OPT: "http://schemas.upnp.org/upnp/1/0/"; ns=01
11:06:04.260 [pimatic-echo] debug:>01-NLS: 1
11:06:04.260 [pimatic-echo] debug:>SERVER: Unspecified, UPnP/1.0, Unspecified
11:06:04.260 [pimatic-echo] debug:>ST: urn:Belkin:device:**
11:06:04.260 [pimatic-echo] debug:>USN: uuid:Socket-1_0-532eaabd-5748-4dbf-8b9b-cc00832c20a6::urn:Belkin:device:**
11:06:04.260 [pimatic-echo] debug:>
11:06:04.260 [pimatic-echo] debug:>
11:06:04.265 [pimatic-echo] debug: >> sent response ssdp discovery response: HTTP/1.1 200 OK
11:06:04.265 [pimatic-echo] debug:>CACHE-CONTROL: max-age=86400
11:06:04.265 [pimatic-echo] debug:>DATE: 2016-10-29
11:06:04.265 [pimatic-echo] debug:>EXT:
11:06:04.265 [pimatic-echo] debug:>LOCATION: http://192.168.178.200:12001/532eaabd-5748-4dbf-8b9b-cc00832c20a6/setup.xml
11:06:04.265 [pimatic-echo] debug:>OPT: "http://schemas.upnp.org/upnp/1/0/"; ns=01
11:06:04.265 [pimatic-echo] debug:>01-NLS: 1
11:06:04.265 [pimatic-echo] debug:>SERVER: Unspecified, UPnP/1.0, Unspecified
11:06:04.265 [pimatic-echo] debug:>ST: urn:Belkin:device:**
11:06:04.265 [pimatic-echo] debug:>USN: uuid:Socket-1_0-532eaabd-5748-4dbf-8b9b-cc00832c20a6::urn:Belkin:device:**
11:06:04.265 [pimatic-echo] debug:>
11:06:04.265 [pimatic-echo] debug:>
11:06:04.267 [pimatic-echo] debug: >> sent response ssdp discovery response: HTTP/1.1 200 OK
11:06:04.267 [pimatic-echo] debug:>CACHE-CONTROL: max-age=86400
11:06:04.267 [pimatic-echo] debug:>DATE: 2016-10-29
11:06:04.267 [pimatic-echo] debug:>EXT:
11:06:04.267 [pimatic-echo] debug:>LOCATION: http://192.168.178.200:12001/532eaabd-5748-4dbf-8b9b-cc00832c20a6/setup.xml
11:06:04.267 [pimatic-echo] debug:>OPT: "http://schemas.upnp.org/upnp/1/0/"; ns=01
11:06:04.267 [pimatic-echo] debug:>01-NLS: 1
11:06:04.267 [pimatic-echo] debug:>SERVER: Unspecified, UPnP/1.0, Unspecified
11:06:04.267 [pimatic-echo] debug:>ST: urn:Belkin:device:**
11:06:04.267 [pimatic-echo] debug:>USN: uuid:Socket-1_0-532eaabd-5748-4dbf-8b9b-cc00832c20a6::urn:Belkin:device:**
11:06:04.267 [pimatic-echo] debug:>
11:06:04.267 [pimatic-echo] debug:>
11:06:04.274 [pimatic-echo] debug: >> sent response ssdp discovery response: HTTP/1.1 200 OK
11:06:04.274 [pimatic-echo] debug:>CACHE-CONTROL: max-age=86400
11:06:04.274 [pimatic-echo] debug:>DATE: 2016-10-29
11:06:04.274 [pimatic-echo] debug:>EXT:
11:06:04.274 [pimatic-echo] debug:>LOCATION: http://192.168.178.200:12002/4df3c3f6-fcc8-427e-842c-0431a72499f1/setup.xml
11:06:04.274 [pimatic-echo] debug:>OPT: "http://schemas.upnp.org/upnp/1/0/"; ns=01
11:06:04.274 [pimatic-echo] debug:>01-NLS: 1
11:06:04.274 [pimatic-echo] debug:>SERVER: Unspecified, UPnP/1.0, Unspecified
11:06:04.274 [pimatic-echo] debug:>ST: urn:Belkin:device:**
11:06:04.274 [pimatic-echo] debug:>USN: uuid:Socket-1_0-4df3c3f6-fcc8-427e-842c-0431a72499f1::urn:Belkin:device:**
11:06:04.274 [pimatic-echo] debug:>
11:06:04.274 [pimatic-echo] debug:>
11:06:04.276 [pimatic-echo] debug: >> sent response ssdp discovery response: HTTP/1.1 200 OK
11:06:04.276 [pimatic-echo] debug:>CACHE-CONTROL: max-age=86400
11:06:04.276 [pimatic-echo] debug:>DATE: 2016-10-29
11:06:04.276 [pimatic-echo] debug:>EXT:
11:06:04.276 [pimatic-echo] debug:>LOCATION: http://192.168.178.200:12002/4df3c3f6-fcc8-427e-842c-0431a72499f1/setup.xml
11:06:04.276 [pimatic-echo] debug:>OPT: "http://schemas.upnp.org/upnp/1/0/"; ns=01
11:06:04.276 [pimatic-echo] debug:>01-NLS: 1
11:06:04.276 [pimatic-echo] debug:>SERVER: Unspecified, UPnP/1.0, Unspecified
11:06:04.276 [pimatic-echo] debug:>ST: urn:Belkin:device:**
11:06:04.276 [pimatic-echo] debug:>USN: uuid:Socket-1_0-4df3c3f6-fcc8-427e-842c-0431a72499f1::urn:Belkin:device:**
11:06:04.276 [pimatic-echo] debug:>
11:06:04.276 [pimatic-echo] debug:>
11:06:04.280 [pimatic-echo] debug: >> sent response ssdp discovery response: HTTP/1.1 200 OK
11:06:04.280 [pimatic-echo] debug:>CACHE-CONTROL: max-age=86400
11:06:04.280 [pimatic-echo] debug:>DATE: 2016-10-29
11:06:04.280 [pimatic-echo] debug:>EXT:
11:06:04.280 [pimatic-echo] debug:>LOCATION: http://192.168.178.200:12002/4df3c3f6-fcc8-427e-842c-0431a72499f1/setup.xml
11:06:04.280 [pimatic-echo] debug:>OPT: "http://schemas.upnp.org/upnp/1/0/"; ns=01
11:06:04.280 [pimatic-echo] debug:>01-NLS: 1
11:06:04.280 [pimatic-echo] debug:>SERVER: Unspecified, UPnP/1.0, Unspecified
11:06:04.280 [pimatic-echo] debug:>ST: urn:Belkin:device:**
11:06:04.280 [pimatic-echo] debug:>USN: uuid:Socket-1_0-4df3c3f6-fcc8-427e-842c-0431a72499f1::urn:Belkin:device:**
11:06:04.280 [pimatic-echo] debug:>
11:06:04.280 [pimatic-echo] debug:>
11:06:04.288 [pimatic-echo] debug: >> sent response ssdp discovery response: HTTP/1.1 200 OK
11:06:04.288 [pimatic-echo] debug:>CACHE-CONTROL: max-age=86400
11:06:04.288 [pimatic-echo] debug:>DATE: 2016-10-29
11:06:04.288 [pimatic-echo] debug:>EXT:
11:06:04.288 [pimatic-echo] debug:>LOCATION: http://192.168.178.200:12002/4df3c3f6-fcc8-427e-842c-0431a72499f1/setup.xml
11:06:04.288 [pimatic-echo] debug:>OPT: "http://schemas.upnp.org/upnp/1/0/"; ns=01
11:06:04.288 [pimatic-echo] debug:>01-NLS: 1
11:06:04.288 [pimatic-echo] debug:>SERVER: Unspecified, UPnP/1.0, Unspecified
11:06:04.288 [pimatic-echo] debug:>ST: urn:Belkin:device:**
11:06:04.288 [pimatic-echo] debug:>USN: uuid:Socket-1_0-4df3c3f6-fcc8-427e-842c-0431a72499f1::urn:Belkin:device:**
11:06:04.288 [pimatic-echo] debug:>
11:06:04.288 [pimatic-echo] debug:>
11:06:04.290 [pimatic-echo] debug: >> sent response ssdp discovery response: HTTP/1.1 200 OK
11:06:04.290 [pimatic-echo] debug:>CACHE-CONTROL: max-age=86400
11:06:04.290 [pimatic-echo] debug:>DATE: 2016-10-29
11:06:04.290 [pimatic-echo] debug:>EXT:
11:06:04.290 [pimatic-echo] debug:>LOCATION: http://192.168.178.200:12002/4df3c3f6-fcc8-427e-842c-0431a72499f1/setup.xml
11:06:04.290 [pimatic-echo] debug:>OPT: "http://schemas.upnp.org/upnp/1/0/"; ns=01
11:06:04.290 [pimatic-echo] debug:>01-NLS: 1
11:06:04.290 [pimatic-echo] debug:>SERVER: Unspecified, UPnP/1.0, Unspecified
11:06:04.290 [pimatic-echo] debug:>ST: urn:Belkin:device:**
11:06:04.290 [pimatic-echo] debug:>USN: uuid:Socket-1_0-4df3c3f6-fcc8-427e-842c-0431a72499f1::urn:Belkin:device:**
11:06:04.290 [pimatic-echo] debug:>
11:06:04.290 [pimatic-echo] debug:>
11:06:04.294 [pimatic-echo] debug: >> sent response ssdp discovery response: HTTP/1.1 200 OK
11:06:04.294 [pimatic-echo] debug:>CACHE-CONTROL: max-age=86400
11:06:04.294 [pimatic-echo] debug:>DATE: 2016-10-29
11:06:04.294 [pimatic-echo] debug:>EXT:
11:06:04.294 [pimatic-echo] debug:>LOCATION: http://192.168.178.200:12002/4df3c3f6-fcc8-427e-842c-0431a72499f1/setup.xml
11:06:04.294 [pimatic-echo] debug:>OPT: "http://schemas.upnp.org/upnp/1/0/"; ns=01
11:06:04.294 [pimatic-echo] debug:>01-NLS: 1
11:06:04.294 [pimatic-echo] debug:>SERVER: Unspecified, UPnP/1.0, Unspecified
11:06:04.294 [pimatic-echo] debug:>ST: urn:Belkin:device:**
11:06:04.294 [pimatic-echo] debug:>USN: uuid:Socket-1_0-4df3c3f6-fcc8-427e-842c-0431a72499f1::urn:Belkin:device:**
11:06:04.294 [pimatic-echo] debug:>
11:06:04.294 [pimatic-echo] debug:>
11:06:04.296 [pimatic-echo] debug: >> sent response ssdp discovery response: HTTP/1.1 200 OK
11:06:04.296 [pimatic-echo] debug:>HOST: 239.255.255.250:1900
11:06:04.296 [pimatic-echo] debug:>CACHE-CONTROL: max-age=100
11:06:04.296 [pimatic-echo] debug:>EXT:
11:06:04.296 [pimatic-echo] debug:>LOCATION: http://192.168.178.200:9876/description.xml
11:06:04.296 [pimatic-echo] debug:>SERVER: Linux/3.14.0 UPnP/1.0 IpBridge/1.19.0
11:06:04.296 [pimatic-echo] debug:>hue-bridgeid: B827EBFFFE5A5980
11:06:04.296 [pimatic-echo] debug:>ST: upnp:rootdevice
11:06:04.296 [pimatic-echo] debug:>USN: uuid:2f402f80-da50-11e1-9b23-b827eb5a5980::upnp:rootdevice
11:06:04.296 [pimatic-echo] debug:>
11:06:04.296 [pimatic-echo] debug:>
11:06:04.298 [pimatic-echo] debug: >> sent response ssdp discovery response: HTTP/1.1 200 OK
11:06:04.298 [pimatic-echo] debug:>HOST: 239.255.255.250:1900
11:06:04.298 [pimatic-echo] debug:>CACHE-CONTROL: max-age=100
11:06:04.298 [pimatic-echo] debug:>EXT:
11:06:04.298 [pimatic-echo] debug:>LOCATION: http://192.168.178.200:9876/description.xml
11:06:04.298 [pimatic-echo] debug:>SERVER: Linux/3.14.0 UPnP/1.0 IpBridge/1.19.0
11:06:04.298 [pimatic-echo] debug:>hue-bridgeid: B827EBFFFE5A5980
11:06:04.298 [pimatic-echo] debug:>ST: upnp:rootdevice
11:06:04.298 [pimatic-echo] debug:>USN: uuid:2f402f80-da50-11e1-9b23-b827eb5a5980::upnp:rootdevice
11:06:04.298 [pimatic-echo] debug:>
11:06:04.298 [pimatic-echo] debug:>
11:06:04.300 [pimatic-echo] debug: >> sent response ssdp discovery response: HTTP/1.1 200 OK
11:06:04.300 [pimatic-echo] debug:>HOST: 239.255.255.250:1900
11:06:04.300 [pimatic-echo] debug:>CACHE-CONTROL: max-age=100
11:06:04.300 [pimatic-echo] debug:>EXT:
11:06:04.300 [pimatic-echo] debug:>LOCATION: http://192.168.178.200:9876/description.xml
11:06:04.300 [pimatic-echo] debug:>SERVER: Linux/3.14.0 UPnP/1.0 IpBridge/1.19.0
11:06:04.300 [pimatic-echo] debug:>hue-bridgeid: B827EBFFFE5A5980
11:06:04.300 [pimatic-echo] debug:>ST: upnp:rootdevice
11:06:04.300 [pimatic-echo] debug:>USN: uuid:2f402f80-da50-11e1-9b23-b827eb5a5980::upnp:rootdevice
11:06:04.300 [pimatic-echo] debug:>
11:06:04.300 [pimatic-echo] debug:>
11:06:04.302 [pimatic-echo] debug: >> sent response ssdp discovery response: HTTP/1.1 200 OK
11:06:04.302 [pimatic-echo] debug:>HOST: 239.255.255.250:1900
11:06:04.302 [pimatic-echo] debug:>CACHE-CONTROL: max-age=100
11:06:04.302 [pimatic-echo] debug:>EXT:
11:06:04.302 [pimatic-echo] debug:>LOCATION: http://192.168.178.200:9876/description.xml
11:06:04.302 [pimatic-echo] debug:>SERVER: Linux/3.14.0 UPnP/1.0 IpBridge/1.19.0
11:06:04.302 [pimatic-echo] debug:>hue-bridgeid: B827EBFFFE5A5980
11:06:04.302 [pimatic-echo] debug:>ST: upnp:rootdevice
11:06:04.302 [pimatic-echo] debug:>USN: uuid:2f402f80-da50-11e1-9b23-b827eb5a5980::upnp:rootdevice
11:06:04.302 [pimatic-echo] debug:>
11:06:04.302 [pimatic-echo] debug:>
11:06:04.304 [pimatic-echo] debug: >> sent response ssdp discovery response: HTTP/1.1 200 OK
11:06:04.304 [pimatic-echo] debug:>HOST: 239.255.255.250:1900
11:06:04.304 [pimatic-echo] debug:>CACHE-CONTROL: max-age=100
11:06:04.304 [pimatic-echo] debug:>EXT:
11:06:04.304 [pimatic-echo] debug:>LOCATION: http://192.168.178.200:9876/description.xml
11:06:04.304 [pimatic-echo] debug:>SERVER: Linux/3.14.0 UPnP/1.0 IpBridge/1.19.0
11:06:04.304 [pimatic-echo] debug:>hue-bridgeid: B827EBFFFE5A5980
11:06:04.304 [pimatic-echo] debug:>ST: upnp:rootdevice
11:06:04.304 [pimatic-echo] debug:>USN: uuid:2f402f80-da50-11e1-9b23-b827eb5a5980::upnp:rootdevice
11:06:04.304 [pimatic-echo] debug:>
11:06:04.304 [pimatic-echo] debug:>
11:06:04.308 [pimatic-echo] debug: >> sent response ssdp discovery response: HTTP/1.1 200 OK
11:06:04.308 [pimatic-echo] debug:>HOST: 239.255.255.250:1900
11:06:04.308 [pimatic-echo] debug:>CACHE-CONTROL: max-age=100
11:06:04.308 [pimatic-echo] debug:>EXT:
11:06:04.308 [pimatic-echo] debug:>LOCATION: http://192.168.178.200:9876/description.xml
11:06:04.308 [pimatic-echo] debug:>SERVER: Linux/3.14.0 UPnP/1.0 IpBridge/1.19.0
11:06:04.308 [pimatic-echo] debug:>hue-bridgeid: B827EBFFFE5A5980
11:06:04.308 [pimatic-echo] debug:>ST: upnp:rootdevice
11:06:04.308 [pimatic-echo] debug:>USN: uuid:2f402f80-da50-11e1-9b23-b827eb5a5980::upnp:rootdevice
11:06:04.308 [pimatic-echo] debug:>
11:06:04.308 [pimatic-echo] debug:>
11:06:04.311 [pimatic-echo] debug: >> sent response ssdp discovery response: HTTP/1.1 200 OK
11:06:04.311 [pimatic-echo] debug:>HOST: 239.255.255.250:1900
11:06:04.311 [pimatic-echo] debug:>CACHE-CONTROL: max-age=100
11:06:04.311 [pimatic-echo] debug:>EXT:
11:06:04.311 [pimatic-echo] debug:>LOCATION: http://192.168.178.200:9876/description.xml
11:06:04.311 [pimatic-echo] debug:>SERVER: Linux/3.14.0 UPnP/1.0 IpBridge/1.19.0
11:06:04.311 [pimatic-echo] debug:>hue-bridgeid: B827EBFFFE5A5980
11:06:04.311 [pimatic-echo] debug:>ST: uuid:2f402f80-da50-11e1-9b23-b827eb5a5980
11:06:04.311 [pimatic-echo] debug:>USN: uuid:2f402f80-da50-11e1-9b23-b827eb5a5980
11:06:04.311 [pimatic-echo] debug:>
11:06:04.311 [pimatic-echo] debug:>
11:06:04.313 [pimatic-echo] debug: >> sent response ssdp discovery response: HTTP/1.1 200 OK
11:06:04.313 [pimatic-echo] debug:>HOST: 239.255.255.250:1900
11:06:04.313 [pimatic-echo] debug:>CACHE-CONTROL: max-age=100
11:06:04.313 [pimatic-echo] debug:>EXT:
11:06:04.313 [pimatic-echo] debug:>LOCATION: http://192.168.178.200:9876/description.xml
11:06:04.313 [pimatic-echo] debug:>SERVER: Linux/3.14.0 UPnP/1.0 IpBridge/1.19.0
11:06:04.313 [pimatic-echo] debug:>hue-bridgeid: B827EBFFFE5A5980
11:06:04.313 [pimatic-echo] debug:>ST: uuid:2f402f80-da50-11e1-9b23-b827eb5a5980
11:06:04.313 [pimatic-echo] debug:>USN: uuid:2f402f80-da50-11e1-9b23-b827eb5a5980
11:06:04.313 [pimatic-echo] debug:>
11:06:04.313 [pimatic-echo] debug:>
11:06:04.318 [pimatic-echo] debug: >> sent response ssdp discovery response: HTTP/1.1 200 OK
11:06:04.318 [pimatic-echo] debug:>HOST: 239.255.255.250:1900
11:06:04.318 [pimatic-echo] debug:>CACHE-CONTROL: max-age=100
11:06:04.318 [pimatic-echo] debug:>EXT:
11:06:04.318 [pimatic-echo] debug:>LOCATION: http://192.168.178.200:9876/description.xml
11:06:04.318 [pimatic-echo] debug:>SERVER: Linux/3.14.0 UPnP/1.0 IpBridge/1.19.0
11:06:04.318 [pimatic-echo] debug:>hue-bridgeid: B827EBFFFE5A5980
11:06:04.318 [pimatic-echo] debug:>ST: uuid:2f402f80-da50-11e1-9b23-b827eb5a5980
11:06:04.318 [pimatic-echo] debug:>USN: uuid:2f402f80-da50-11e1-9b23-b827eb5a5980
11:06:04.318 [pimatic-echo] debug:>
11:06:04.318 [pimatic-echo] debug:>
11:06:04.322 [pimatic-echo] debug: >> sent response ssdp discovery response: HTTP/1.1 200 OK
11:06:04.322 [pimatic-echo] debug:>HOST: 239.255.255.250:1900
11:06:04.322 [pimatic-echo] debug:>CACHE-CONTROL: max-age=100
11:06:04.322 [pimatic-echo] debug:>EXT:
11:06:04.322 [pimatic-echo] debug:>LOCATION: http://192.168.178.200:9876/description.xml
11:06:04.322 [pimatic-echo] debug:>SERVER: Linux/3.14.0 UPnP/1.0 IpBridge/1.19.0
11:06:04.322 [pimatic-echo] debug:>hue-bridgeid: B827EBFFFE5A5980
11:06:04.322 [pimatic-echo] debug:>ST: uuid:2f402f80-da50-11e1-9b23-b827eb5a5980
11:06:04.322 [pimatic-echo] debug:>USN: uuid:2f402f80-da50-11e1-9b23-b827eb5a5980
11:06:04.322 [pimatic-echo] debug:>
11:06:04.322 [pimatic-echo] debug:>
11:06:04.331 [pimatic-echo] debug: >> sent response ssdp discovery response: HTTP/1.1 200 OK
11:06:04.331 [pimatic-echo] debug:>HOST: 239.255.255.250:1900
11:06:04.331 [pimatic-echo] debug:>CACHE-CONTROL: max-age=100
11:06:04.331 [pimatic-echo] debug:>EXT:
11:06:04.331 [pimatic-echo] debug:>LOCATION: http://192.168.178.200:9876/description.xml
11:06:04.331 [pimatic-echo] debug:>SERVER: Linux/3.14.0 UPnP/1.0 IpBridge/1.19.0
11:06:04.331 [pimatic-echo] debug:>hue-bridgeid: B827EBFFFE5A5980
11:06:04.331 [pimatic-echo] debug:>ST: uuid:2f402f80-da50-11e1-9b23-b827eb5a5980
11:06:04.331 [pimatic-echo] debug:>USN: uuid:2f402f80-da50-11e1-9b23-b827eb5a5980
11:06:04.331 [pimatic-echo] debug:>
11:06:04.331 [pimatic-echo] debug:>
11:06:04.335 [pimatic-echo] debug: >> sent response ssdp discovery response: HTTP/1.1 200 OK
11:06:04.335 [pimatic-echo] debug:>HOST: 239.255.255.250:1900
11:06:04.335 [pimatic-echo] debug:>CACHE-CONTROL: max-age=100
11:06:04.335 [pimatic-echo] debug:>EXT:
11:06:04.335 [pimatic-echo] debug:>LOCATION: http://192.168.178.200:9876/description.xml
11:06:04.335 [pimatic-echo] debug:>SERVER: Linux/3.14.0 UPnP/1.0 IpBridge/1.19.0
11:06:04.335 [pimatic-echo] debug:>hue-bridgeid: B827EBFFFE5A5980
11:06:04.335 [pimatic-echo] debug:>ST: uuid:2f402f80-da50-11e1-9b23-b827eb5a5980
11:06:04.335 [pimatic-echo] debug:>USN: uuid:2f402f80-da50-11e1-9b23-b827eb5a5980
11:06:04.335 [pimatic-echo] debug:>
11:06:04.335 [pimatic-echo] debug:>
11:06:04.338 [pimatic-echo] debug: >> sent response ssdp discovery response: HTTP/1.1 200 OK
11:06:04.338 [pimatic-echo] debug:>HOST: 239.255.255.250:1900
11:06:04.338 [pimatic-echo] debug:>CACHE-CONTROL: max-age=100
11:06:04.338 [pimatic-echo] debug:>LOCATION: http://192.168.178.200:9876/description.xml
11:06:04.338 [pimatic-echo] debug:>SERVER: Linux/3.14.0 UPnP/1.0 IpBridge/1.19.0
11:06:04.338 [pimatic-echo] debug:>hue-bridgeid: B827EBFFFE5A5980
11:06:04.338 [pimatic-echo] debug:>ST: urn:schemas-upnp-org:device:basic:1
11:06:04.338 [pimatic-echo] debug:>USN: uuid:2f402f80-da50-11e1-9b23-b827eb5a5980
11:06:04.338 [pimatic-echo] debug:>
11:06:04.338 [pimatic-echo] debug:>
11:06:04.343 [pimatic-echo] debug: complete sending all responses.
11:06:04.347 [pimatic-echo] debug: >> sent response ssdp discovery response: HTTP/1.1 200 OK
11:06:04.347 [pimatic-echo] debug:>HOST: 239.255.255.250:1900
11:06:04.347 [pimatic-echo] debug:>CACHE-CONTROL: max-age=100
11:06:04.347 [pimatic-echo] debug:>LOCATION: http://192.168.178.200:9876/description.xml
11:06:04.347 [pimatic-echo] debug:>SERVER: Linux/3.14.0 UPnP/1.0 IpBridge/1.19.0
11:06:04.347 [pimatic-echo] debug:>hue-bridgeid: B827EBFFFE5A5980
11:06:04.347 [pimatic-echo] debug:>ST: urn:schemas-upnp-org:device:basic:1
11:06:04.347 [pimatic-echo] debug:>USN: uuid:2f402f80-da50-11e1-9b23-b827eb5a5980
11:06:04.347 [pimatic-echo] debug:>
11:06:04.347 [pimatic-echo] debug:>
11:06:04.349 [pimatic-echo] debug: complete sending all responses.
11:06:04.351 [pimatic-echo] debug: >> sent response ssdp discovery response: HTTP/1.1 200 OK
11:06:04.351 [pimatic-echo] debug:>HOST: 239.255.255.250:1900
11:06:04.351 [pimatic-echo] debug:>CACHE-CONTROL: max-age=100
11:06:04.351 [pimatic-echo] debug:>LOCATION: http://192.168.178.200:9876/description.xml
11:06:04.351 [pimatic-echo] debug:>SERVER: Linux/3.14.0 UPnP/1.0 IpBridge/1.19.0
11:06:04.351 [pimatic-echo] debug:>hue-bridgeid: B827EBFFFE5A5980
11:06:04.351 [pimatic-echo] debug:>ST: urn:schemas-upnp-org:device:basic:1
11:06:04.351 [pimatic-echo] debug:>USN: uuid:2f402f80-da50-11e1-9b23-b827eb5a5980
11:06:04.351 [pimatic-echo] debug:>
11:06:04.351 [pimatic-echo] debug:>
11:06:04.358 [pimatic-echo] debug: complete sending all responses.
11:06:04.363 [pimatic-echo] debug: >> sent response ssdp discovery response: HTTP/1.1 200 OK
11:06:04.363 [pimatic-echo] debug:>HOST: 239.255.255.250:1900
11:06:04.363 [pimatic-echo] debug:>CACHE-CONTROL: max-age=100
11:06:04.363 [pimatic-echo] debug:>LOCATION: http://192.168.178.200:9876/description.xml
11:06:04.363 [pimatic-echo] debug:>SERVER: Linux/3.14.0 UPnP/1.0 IpBridge/1.19.0
11:06:04.363 [pimatic-echo] debug:>hue-bridgeid: B827EBFFFE5A5980
11:06:04.363 [pimatic-echo] debug:>ST: urn:schemas-upnp-org:device:basic:1
11:06:04.363 [pimatic-echo] debug:>USN: uuid:2f402f80-da50-11e1-9b23-b827eb5a5980
11:06:04.363 [pimatic-echo] debug:>
11:06:04.363 [pimatic-echo] debug:>
11:06:04.365 [pimatic-echo] debug: complete sending all responses.
11:06:04.367 [pimatic-echo] debug: >> sent response ssdp discovery response: HTTP/1.1 200 OK
11:06:04.367 [pimatic-echo] debug:>HOST: 239.255.255.250:1900
11:06:04.367 [pimatic-echo] debug:>CACHE-CONTROL: max-age=100
11:06:04.367 [pimatic-echo] debug:>LOCATION: http://192.168.178.200:9876/description.xml
11:06:04.367 [pimatic-echo] debug:>SERVER: Linux/3.14.0 UPnP/1.0 IpBridge/1.19.0
11:06:04.367 [pimatic-echo] debug:>hue-bridgeid: B827EBFFFE5A5980
11:06:04.367 [pimatic-echo] debug:>ST: urn:schemas-upnp-org:device:basic:1
11:06:04.367 [pimatic-echo] debug:>USN: uuid:2f402f80-da50-11e1-9b23-b827eb5a5980
11:06:04.367 [pimatic-echo] debug:>
11:06:04.367 [pimatic-echo] debug:>
11:06:04.369 [pimatic-echo] debug: complete sending all responses.
11:06:04.373 [pimatic-echo] debug: >> sent response ssdp discovery response: HTTP/1.1 200 OK
11:06:04.373 [pimatic-echo] debug:>HOST: 239.255.255.250:1900
11:06:04.373 [pimatic-echo] debug:>CACHE-CONTROL: max-age=100
11:06:04.373 [pimatic-echo] debug:>LOCATION: http://192.168.178.200:9876/description.xml
11:06:04.373 [pimatic-echo] debug:>SERVER: Linux/3.14.0 UPnP/1.0 IpBridge/1.19.0
11:06:04.373 [pimatic-echo] debug:>hue-bridgeid: B827EBFFFE5A5980
11:06:04.373 [pimatic-echo] debug:>ST: urn:schemas-upnp-org:device:basic:1
11:06:04.373 [pimatic-echo] debug:>USN: uuid:2f402f80-da50-11e1-9b23-b827eb5a5980
11:06:04.373 [pimatic-echo] debug:>
11:06:04.373 [pimatic-echo] debug:>
11:06:04.374 [pimatic-echo] debug: complete sending all responses.
11:06:04.590 [pimatic-echo] debug: << server got: M-SEARCH * HTTP/1.1
11:06:04.590 [pimatic-echo] debug:>MX: 3
11:06:04.590 [pimatic-echo] debug:>ST: ssdp:all
11:06:04.590 [pimatic-echo] debug:>HOST: 239.255.255.250:1900
11:06:04.590 [pimatic-echo] debug:>MAN: "ssdp:discover"
11:06:04.590 [pimatic-echo] debug:>
11:06:04.590 [pimatic-echo] debug:> from 192.168.178.111:50000
11:06:04.593 [pimatic-echo] debug: >> sent response ssdp discovery response: HTTP/1.1 200 OK
11:06:04.593 [pimatic-echo] debug:>CACHE-CONTROL: max-age=86400
11:06:04.593 [pimatic-echo] debug:>DATE: 2016-10-29
11:06:04.593 [pimatic-echo] debug:>EXT:
11:06:04.593 [pimatic-echo] debug:>LOCATION: http://192.168.178.200:12000/c8bee773-e838-4513-88ec-6268d9900b6a/setup.xml
11:06:04.593 [pimatic-echo] debug:>OPT: "http://schemas.upnp.org/upnp/1/0/"; ns=01
11:06:04.593 [pimatic-echo] debug:>01-NLS: 1
11:06:04.593 [pimatic-echo] debug:>SERVER: Unspecified, UPnP/1.0, Unspecified
11:06:04.593 [pimatic-echo] debug:>ST: urn:Belkin:device:**
11:06:04.593 [pimatic-echo] debug:>USN: uuid:Socket-1_0-c8bee773-e838-4513-88ec-6268d9900b6a::urn:Belkin:device:**
11:06:04.593 [pimatic-echo] debug:>
11:06:04.593 [pimatic-echo] debug:>
11:06:04.599 [pimatic-echo] debug: >> sent response ssdp discovery response: HTTP/1.1 200 OK
11:06:04.599 [pimatic-echo] debug:>CACHE-CONTROL: max-age=86400
11:06:04.599 [pimatic-echo] debug:>DATE: 2016-10-29
11:06:04.599 [pimatic-echo] debug:>EXT:
11:06:04.599 [pimatic-echo] debug:>LOCATION: http://192.168.178.200:12001/532eaabd-5748-4dbf-8b9b-cc00832c20a6/setup.xml
11:06:04.599 [pimatic-echo] debug:>OPT: "http://schemas.upnp.org/upnp/1/0/"; ns=01
11:06:04.599 [pimatic-echo] debug:>01-NLS: 1
11:06:04.599 [pimatic-echo] debug:>SERVER: Unspecified, UPnP/1.0, Unspecified
11:06:04.599 [pimatic-echo] debug:>ST: urn:Belkin:device:**
11:06:04.599 [pimatic-echo] debug:>USN: uuid:Socket-1_0-532eaabd-5748-4dbf-8b9b-cc00832c20a6::urn:Belkin:device:**
11:06:04.599 [pimatic-echo] debug:>
11:06:04.599 [pimatic-echo] debug:>
11:06:04.601 [pimatic-echo] debug: >> sent response ssdp discovery response: HTTP/1.1 200 OK
11:06:04.601 [pimatic-echo] debug:>CACHE-CONTROL: max-age=86400
11:06:04.601 [pimatic-echo] debug:>DATE: 2016-10-29
11:06:04.601 [pimatic-echo] debug:>EXT:
11:06:04.601 [pimatic-echo] debug:>LOCATION: http://192.168.178.200:12002/4df3c3f6-fcc8-427e-842c-0431a72499f1/setup.xml
11:06:04.601 [pimatic-echo] debug:>OPT: "http://schemas.upnp.org/upnp/1/0/"; ns=01
11:06:04.601 [pimatic-echo] debug:>01-NLS: 1
11:06:04.601 [pimatic-echo] debug:>SERVER: Unspecified, UPnP/1.0, Unspecified
11:06:04.601 [pimatic-echo] debug:>ST: urn:Belkin:device:**
11:06:04.601 [pimatic-echo] debug:>USN: uuid:Socket-1_0-4df3c3f6-fcc8-427e-842c-0431a72499f1::urn:Belkin:device:**
11:06:04.601 [pimatic-echo] debug:>
11:06:04.601 [pimatic-echo] debug:>
11:06:04.604 [pimatic-echo] debug: >> sent response ssdp discovery response: HTTP/1.1 200 OK
11:06:04.604 [pimatic-echo] debug:>HOST: 239.255.255.250:1900
11:06:04.604 [pimatic-echo] debug:>CACHE-CONTROL: max-age=100
11:06:04.604 [pimatic-echo] debug:>EXT:
11:06:04.604 [pimatic-echo] debug:>LOCATION: http://192.168.178.200:9876/description.xml
11:06:04.604 [pimatic-echo] debug:>SERVER: Linux/3.14.0 UPnP/1.0 IpBridge/1.19.0
11:06:04.604 [pimatic-echo] debug:>hue-bridgeid: B827EBFFFE5A5980
11:06:04.604 [pimatic-echo] debug:>ST: upnp:rootdevice
11:06:04.604 [pimatic-echo] debug:>USN: uuid:2f402f80-da50-11e1-9b23-b827eb5a5980::upnp:rootdevice
11:06:04.604 [pimatic-echo] debug:>
11:06:04.604 [pimatic-echo] debug:>
11:06:04.609 [pimatic-echo] debug: >> sent response ssdp discovery response: HTTP/1.1 200 OK
11:06:04.609 [pimatic-echo] debug:>HOST: 239.255.255.250:1900
11:06:04.609 [pimatic-echo] debug:>CACHE-CONTROL: max-age=100
11:06:04.609 [pimatic-echo] debug:>EXT:
11:06:04.609 [pimatic-echo] debug:>LOCATION: http://192.168.178.200:9876/description.xml
11:06:04.609 [pimatic-echo] debug:>SERVER: Linux/3.14.0 UPnP/1.0 IpBridge/1.19.0
11:06:04.609 [pimatic-echo] debug:>hue-bridgeid: B827EBFFFE5A5980
11:06:04.609 [pimatic-echo] debug:>ST: uuid:2f402f80-da50-11e1-9b23-b827eb5a5980
11:06:04.609 [pimatic-echo] debug:>USN: uuid:2f402f80-da50-11e1-9b23-b827eb5a5980
11:06:04.609 [pimatic-echo] debug:>
11:06:04.609 [pimatic-echo] debug:>
11:06:04.611 [pimatic-echo] debug: >> sent response ssdp discovery response: HTTP/1.1 200 OK
11:06:04.611 [pimatic-echo] debug:>HOST: 239.255.255.250:1900
11:06:04.611 [pimatic-echo] debug:>CACHE-CONTROL: max-age=100
11:06:04.611 [pimatic-echo] debug:>LOCATION: http://192.168.178.200:9876/description.xml
11:06:04.611 [pimatic-echo] debug:>SERVER: Linux/3.14.0 UPnP/1.0 IpBridge/1.19.0
11:06:04.611 [pimatic-echo] debug:>hue-bridgeid: B827EBFFFE5A5980
11:06:04.611 [pimatic-echo] debug:>ST: urn:schemas-upnp-org:device:basic:1
11:06:04.611 [pimatic-echo] debug:>USN: uuid:2f402f80-da50-11e1-9b23-b827eb5a5980
11:06:04.611 [pimatic-echo] debug:>
11:06:04.611 [pimatic-echo] debug:>
11:06:04.614 [pimatic-echo] debug: complete sending all responses.
11:06:04.622 [pimatic-echo] debug: << server got: M-SEARCH * HTTP/1.1
11:06:04.622 [pimatic-echo] debug:>MX: 3
11:06:04.622 [pimatic-echo] debug:>ST: upnp:rootdevice
11:06:04.622 [pimatic-echo] debug:>HOST: 239.255.255.250:1900
11:06:04.622 [pimatic-echo] debug:>MAN: "ssdp:discover"
11:06:04.622 [pimatic-echo] debug:>
11:06:04.622 [pimatic-echo] debug:> from 192.168.178.111:50000
11:06:04.624 [pimatic-echo] debug: >> sent response ssdp discovery response: HTTP/1.1 200 OK
11:06:04.624 [pimatic-echo] debug:>CACHE-CONTROL: max-age=86400
11:06:04.624 [pimatic-echo] debug:>DATE: 2016-10-29
11:06:04.624 [pimatic-echo] debug:>EXT:
11:06:04.624 [pimatic-echo] debug:>LOCATION: http://192.168.178.200:12000/c8bee773-e838-4513-88ec-6268d9900b6a/setup.xml
11:06:04.624 [pimatic-echo] debug:>OPT: "http://schemas.upnp.org/upnp/1/0/"; ns=01
11:06:04.624 [pimatic-echo] debug:>01-NLS: 1
11:06:04.624 [pimatic-echo] debug:>SERVER: Unspecified, UPnP/1.0, Unspecified
11:06:04.624 [pimatic-echo] debug:>ST: urn:Belkin:device:**
11:06:04.624 [pimatic-echo] debug:>USN: uuid:Socket-1_0-c8bee773-e838-4513-88ec-6268d9900b6a::urn:Belkin:device:**
11:06:04.624 [pimatic-echo] debug:>
11:06:04.624 [pimatic-echo] debug:>
11:06:04.626 [pimatic-echo] debug: >> sent response ssdp discovery response: HTTP/1.1 200 OK
11:06:04.626 [pimatic-echo] debug:>CACHE-CONTROL: max-age=86400
11:06:04.626 [pimatic-echo] debug:>DATE: 2016-10-29
11:06:04.626 [pimatic-echo] debug:>EXT:
11:06:04.626 [pimatic-echo] debug:>LOCATION: http://192.168.178.200:12001/532eaabd-5748-4dbf-8b9b-cc00832c20a6/setup.xml
11:06:04.626 [pimatic-echo] debug:>OPT: "http://schemas.upnp.org/upnp/1/0/"; ns=01
11:06:04.626 [pimatic-echo] debug:>01-NLS: 1
11:06:04.626 [pimatic-echo] debug:>SERVER: Unspecified, UPnP/1.0, Unspecified
11:06:04.626 [pimatic-echo] debug:>ST: urn:Belkin:device:**
11:06:04.626 [pimatic-echo] debug:>USN: uuid:Socket-1_0-532eaabd-5748-4dbf-8b9b-cc00832c20a6::urn:Belkin:device:**
11:06:04.626 [pimatic-echo] debug:>
11:06:04.626 [pimatic-echo] debug:>
11:06:04.629 [pimatic-echo] debug: >> sent response ssdp discovery response: HTTP/1.1 200 OK
11:06:04.629 [pimatic-echo] debug:>CACHE-CONTROL: max-age=86400
11:06:04.629 [pimatic-echo] debug:>DATE: 2016-10-29
11:06:04.629 [pimatic-echo] debug:>EXT:
11:06:04.629 [pimatic-echo] debug:>LOCATION: http://192.168.178.200:12002/4df3c3f6-fcc8-427e-842c-0431a72499f1/setup.xml
11:06:04.629 [pimatic-echo] debug:>OPT: "http://schemas.upnp.org/upnp/1/0/"; ns=01
11:06:04.629 [pimatic-echo] debug:>01-NLS: 1
11:06:04.629 [pimatic-echo] debug:>SERVER: Unspecified, UPnP/1.0, Unspecified
11:06:04.629 [pimatic-echo] debug:>ST: urn:Belkin:device:**
11:06:04.629 [pimatic-echo] debug:>USN: uuid:Socket-1_0-4df3c3f6-fcc8-427e-842c-0431a72499f1::urn:Belkin:device:**
11:06:04.629 [pimatic-echo] debug:>
11:06:04.629 [pimatic-echo] debug:>
11:06:04.637 [pimatic-echo] debug: >> sent response ssdp discovery response: HTTP/1.1 200 OK
11:06:04.637 [pimatic-echo] debug:>HOST: 239.255.255.250:1900
11:06:04.637 [pimatic-echo] debug:>CACHE-CONTROL: max-age=100
11:06:04.637 [pimatic-echo] debug:>EXT:
11:06:04.637 [pimatic-echo] debug:>LOCATION: http://192.168.178.200:9876/description.xml
11:06:04.637 [pimatic-echo] debug:>SERVER: Linux/3.14.0 UPnP/1.0 IpBridge/1.19.0
11:06:04.637 [pimatic-echo] debug:>hue-bridgeid: B827EBFFFE5A5980
11:06:04.637 [pimatic-echo] debug:>ST: upnp:rootdevice
11:06:04.637 [pimatic-echo] debug:>USN: uuid:2f402f80-da50-11e1-9b23-b827eb5a5980::upnp:rootdevice
11:06:04.637 [pimatic-echo] debug:>
11:06:04.637 [pimatic-echo] debug:>
11:06:04.639 [pimatic-echo] debug: >> sent response ssdp discovery response: HTTP/1.1 200 OK
11:06:04.639 [pimatic-echo] debug:>HOST: 239.255.255.250:1900
11:06:04.639 [pimatic-echo] debug:>CACHE-CONTROL: max-age=100
11:06:04.639 [pimatic-echo] debug:>EXT:
11:06:04.639 [pimatic-echo] debug:>LOCATION: http://192.168.178.200:9876/description.xml
11:06:04.639 [pimatic-echo] debug:>SERVER: Linux/3.14.0 UPnP/1.0 IpBridge/1.19.0
11:06:04.639 [pimatic-echo] debug:>hue-bridgeid: B827EBFFFE5A5980
11:06:04.639 [pimatic-echo] debug:>ST: uuid:2f402f80-da50-11e1-9b23-b827eb5a5980
11:06:04.639 [pimatic-echo] debug:>USN: uuid:2f402f80-da50-11e1-9b23-b827eb5a5980
11:06:04.639 [pimatic-echo] debug:>
11:06:04.639 [pimatic-echo] debug:>
11:06:04.642 [pimatic-echo] debug: >> sent response ssdp discovery response: HTTP/1.1 200 OK
11:06:04.642 [pimatic-echo] debug:>HOST: 239.255.255.250:1900
11:06:04.642 [pimatic-echo] debug:>CACHE-CONTROL: max-age=100
11:06:04.642 [pimatic-echo] debug:>LOCATION: http://192.168.178.200:9876/description.xml
11:06:04.642 [pimatic-echo] debug:>SERVER: Linux/3.14.0 UPnP/1.0 IpBridge/1.19.0
11:06:04.642 [pimatic-echo] debug:>hue-bridgeid: B827EBFFFE5A5980
11:06:04.642 [pimatic-echo] debug:>ST: urn:schemas-upnp-org:device:basic:1
11:06:04.642 [pimatic-echo] debug:>USN: uuid:2f402f80-da50-11e1-9b23-b827eb5a5980
11:06:04.642 [pimatic-echo] debug:>
11:06:04.642 [pimatic-echo] debug:>
11:06:04.646 [pimatic-echo] debug: complete sending all responses.
`
My Echo has the IP 192.168.178.111

**Comment by michbeck100** [comment]
Can't tell whats wrong with this setup. Everything looks fine. Does you echo find no devices at all? Or just some of them? You could try, if it helps to remote all devices from pimatic, except for one.

**Comment by 0rTiN** [comment]
Alexa finds no device at all. 
You mean remove all device, not remote right? Will try later.

**Comment by michbeck100** [comment]
Remove all remote pimatic devices from Alexa too

**Comment by michbeck100** [comment]
@manacker Did version 0.4 change anything?

**Comment by chefonso** [comment]
Hi, I have also a nice Problem.
If I use only the Echo2 than I can't find any device. 
But If I use a Dot2 than I can find all devices. (Without a change in Pimatic config)

When I use both devices in my network than also the Echo2 can control my pimatic devices.

Do you have any idea why?
 
MfG Lukas

**Comment by michbeck100** [comment]
@chefonso No, not yet. It seems that the echo 2 changed something in the way they connect to the devices. Since i don't have an echo 2, yet, its hard to investigate.

**Comment by chefonso** [comment]
Ok, thanks for the fast response. Danke für die schnelle Antwort.

**Comment by manacker** [comment]
@michbeck100 Unfortunately not. I even reset the Echo Dot. Any idea what I can try to narrow the issue down?

**Comment by michbeck100** [comment]
No, since you are using the Echo Dot it should be working, as i'm using the dot, too. The only thing i could imagine is your hardware/network setup. I am using a raspi 3, connected by LAN. The echo dot is directly connected to the same router as the raspi

**Comment by manacker** [comment]
Thats pretty much the same as mine. Echo Dot via WiFi raspi 2 via cable on the same FritzBox.
I fiddled around a bit with tcpdump. Im no expert and maybe I'm missing something, but it looks to me as if no response gets sent:

```
root@pimatic:/home/pi# tcpdump -i eth0 udp and \(host 192.168.10.101 or host 192.168.10.136\)
tcpdump: verbose output suppressed, use -v or -vv for full protocol decode
listening on eth0, link-type EN10MB (Ethernet), capture size 262144 bytes
22:33:15.876220 IP echo-dot.fritz.box.50000 > 239.255.255.250.1900: UDP, length 107
22:33:15.976270 IP echo-dot.fritz.box.50000 > 239.255.255.250.1900: UDP, length 107
22:33:16.078921 IP echo-dot.fritz.box.50000 > 239.255.255.250.1900: UDP, length 122
22:33:16.179179 IP echo-dot.fritz.box.50000 > 239.255.255.250.1900: UDP, length 122
````
Any idea, why that might be?

**Comment by michbeck100** [comment]
Does the discovery work if you change the port to 80 in plugin config. This is necessary if you are using a new echo. Maybe it helps in your case, too.

**Comment by mfanafuthi** [comment]
same Problem here. Changing to port 80 does not help either.

**Comment by michbeck100** [comment]
I'm closing this ticket for now, because the latest release fixes most of the discovery problems. Please make sure to read https://forum.pimatic.org/topic/2648/pimatic-echo-control-your-pimatic-devices-using-amazon-s-echo/175 before reopening this issue.
